/home/zhengkun-li/frost-risk-forecast-challenge/.venv/lib/python3.12/site-packages/xgboost/training.py:199: UserWarning: [20:58:35] WARNING: /workspace/src/learner.cc:790: 
Parameters: { "force_col_wise", "num_leaves", "verbose" } are not used.

  bst.update(dtrain, iteration=i, fobj=obj)
Output directory: experiments/xgboost/top175_features

============================================================
Step 1: Loading Data
============================================================
Loading 18 station files from /home/zhengkun-li/frost-risk-forecast-challenge/data/raw/frost-risk-forecast-challenge/stations...
  Loaded 5/18 files...  Loaded 10/18 files...  Loaded 15/18 files...  Loaded 18/18 files...
Combining 18 station DataFrames...
Combined data: 2367360 rows, 26 columns
Stations: 18
Loaded 2367360 rows, 26 columns
Optimizing data types to reduce memory...
Memory usage after optimization: 1.50 GB

============================================================
Step 2: Cleaning Data
============================================================
After cleaning: 2367360 rows

============================================================
Step 3: Feature Engineering
============================================================
After feature engineering: 2367360 rows, 313 columns
Memory usage: 3.95 GB
Optimizing feature data types...
Memory usage after optimization: 3.95 GB

============================================================
Step 4: Creating Frost Labels
============================================================
  3h horizon: 20579.0/2367360 frost events (0.87%)
  6h horizon: 20579.0/2367360 frost events (0.87%)
  12h horizon: 20579.0/2367360 frost events (0.87%)
  24h horizon: 20579.0/2367360 frost events (0.87%)

Saved labeled data to experiments/xgboost/top175_features/labeled_data.parquet

Using top 175 features based on importance
  Importance file: /home/zhengkun-li/frost-risk-forecast-challenge/experiments/lightgbm/feature_importance/feature_importance_3h_all.csv

============================================================
Training models for 3h horizon
============================================================
  Applying feature selection...
    Original features: 298
    Loaded feature importance from /home/zhengkun-li/frost-risk-forecast-challenge/experiments/lightgbm/feature_importance/feature_importance_3h_all.csv
  After selecting by importance: 175 features
    Selected features: 175
    Removed features: 123
Features: 175
Samples: 2367306
Frost events: 20579.0 (0.87%)
Train: 1657078, Val: 355087, Test: 355090

Training classification model for frost probability...
[0]	validation_0-logloss:0.02755
[1]	validation_0-logloss:0.02633
[2]	validation_0-logloss:0.02520
[3]	validation_0-logloss:0.02435
[4]	validation_0-logloss:0.02361
[5]	validation_0-logloss:0.02291
[6]	validation_0-logloss:0.02236
[7]	validation_0-logloss:0.02176
[8]	validation_0-logloss:0.02123
[9]	validation_0-logloss:0.02075
[10]	validation_0-logloss:0.02029
[11]	validation_0-logloss:0.01988
[12]	validation_0-logloss:0.01951
[13]	validation_0-logloss:0.01912
[14]	validation_0-logloss:0.01880
[15]	validation_0-logloss:0.01848
[16]	validation_0-logloss:0.01822
[17]	validation_0-logloss:0.01795
[18]	validation_0-logloss:0.01768
[19]	validation_0-logloss:0.01737
[20]	validation_0-logloss:0.01714
[21]	validation_0-logloss:0.01696
[22]	validation_0-logloss:0.01670
[23]	validation_0-logloss:0.01655
[24]	validation_0-logloss:0.01641
[25]	validation_0-logloss:0.01621
[26]	validation_0-logloss:0.01609
[27]	validation_0-logloss:0.01593
[28]	validation_0-logloss:0.01575
[29]	validation_0-logloss:0.01558
[30]	validation_0-logloss:0.01542
[31]	validation_0-logloss:0.01531
[32]	validation_0-logloss:0.01519
[33]	validation_0-logloss:0.01511
[34]	validation_0-logloss:0.01502
[35]	validation_0-logloss:0.01488
[36]	validation_0-logloss:0.01484
[37]	validation_0-logloss:0.01474
[38]	validation_0-logloss:0.01466
[39]	validation_0-logloss:0.01459
[40]	validation_0-logloss:0.01453
[41]	validation_0-logloss:0.01449
[42]	validation_0-logloss:0.01444
[43]	validation_0-logloss:0.01439
[44]	validation_0-logloss:0.01435
[45]	validation_0-logloss:0.01430
[46]	validation_0-logloss:0.01423
[47]	validation_0-logloss:0.01421
[48]	validation_0-logloss:0.01414
[49]	validation_0-logloss:0.01409
[50]	validation_0-logloss:0.01406
[51]	validation_0-logloss:0.01403
[52]	validation_0-logloss:0.01399
[53]	validation_0-logloss:0.01396
[54]	validation_0-logloss:0.01392
[55]	validation_0-logloss:0.01388
[56]	validation_0-logloss:0.01386
[57]	validation_0-logloss:0.01384
[58]	validation_0-logloss:0.01383
[59]	validation_0-logloss:0.01380
[60]	validation_0-logloss:0.01377
[61]	validation_0-logloss:0.01374
[62]	validation_0-logloss:0.01369
[63]	validation_0-logloss:0.01367
[64]	validation_0-logloss:0.01364
[65]	validation_0-logloss:0.01364
[66]	validation_0-logloss:0.01360
[67]	validation_0-logloss:0.01362
[68]	validation_0-logloss:0.01361
[69]	validation_0-logloss:0.01361
[70]	validation_0-logloss:0.01360
[71]	validation_0-logloss:0.01359
[72]	validation_0-logloss:0.01357
[73]	validation_0-logloss:0.01356
[74]	validation_0-logloss:0.01356
[75]	validation_0-logloss:0.01354
[76]	validation_0-logloss:0.01353
[77]	validation_0-logloss:0.01351
[78]	validation_0-logloss:0.01352
[79]	validation_0-logloss:0.01350
[80]	validation_0-logloss:0.01351
[81]	validation_0-logloss:0.01350
[82]	validation_0-logloss:0.01350
[83]	validation_0-logloss:0.01350
[84]	validation_0-logloss:0.01348
[85]	validation_0-logloss:0.01348
[86]	validation_0-logloss:0.01348
[87]	validation_0-logloss:0.01350
[88]	validation_0-logloss:0.01349
[89]	validation_0-logloss:0.01350
[90]	validation_0-logloss:0.01349
[91]	validation_0-logloss:0.01348
[92]	validation_0-logloss:0.01350
[93]	validation_0-logloss:0.01350
[94]	validation_0-logloss:0.01350
[95]	validation_0-logloss:0.01350
[96]	validation_0-logloss:0.01349
[97]	validation_0-logloss:0.01349
[98]	validation_0-logloss:0.01349
[99]	validation_0-logloss:0.01347
[100]	validation_0-logloss:0.01347
[101]	validation_0-logloss:0.01347
[102]	validation_0-logloss:0.01346
[103]	validation_0-logloss:0.01346
[104]	validation_0-logloss:0.01346
[105]	validation_0-logloss:0.01344
[106]	validation_0-logloss:0.01344
[107]	validation_0-logloss:0.01343
[108]	validation_0-logloss:0.01343
[109]	validation_0-logloss:0.01342
[110]	validation_0-logloss:0.01341
[111]	validation_0-logloss:0.01339
[112]	validation_0-logloss:0.01339
[113]	validation_0-logloss:0.01339
[114]	validation_0-logloss:0.01338
[115]	validation_0-logloss:0.01342
[116]	validation_0-logloss:0.01341
[117]	validation_0-logloss:0.01341
[118]	validation_0-logloss:0.01339
[119]	validation_0-logloss:0.01342
[120]	validation_0-logloss:0.01343
[121]	validation_0-logloss:0.01343
[122]	validation_0-logloss:0.01343
[123]	validation_0-logloss:0.01343
[124]	validation_0-logloss:0.01345
[125]	validation_0-logloss:0.01344
[126]	validation_0-logloss:0.01342
[127]	validation_0-logloss:0.01342
[128]	validation_0-logloss:0.01339
[129]	validation_0-logloss:0.01340
[130]	validation_0-logloss:0.01339
[131]	validation_0-logloss:0.01340
[132]	validation_0-logloss:0.01340
[133]	validation_0-logloss:0.01341
[134]	validation_0-logloss:0.01346
[135]	validation_0-logloss:0.01346
[136]	validation_0-logloss:0.01347
[137]	validation_0-logloss:0.01349
[138]	validation_0-logloss:0.01351
[139]	validation_0-logloss:0.01352
[140]	validation_0-logloss:0.01353
[141]	validation_0-logloss:0.01355
[142]	validation_0-logloss:0.01354
[143]	validation_0-logloss:0.01354
[144]	validation_0-logloss:0.01354
[145]	validation_0-logloss:0.01354
[146]	validation_0-logloss:0.01357
[147]	validation_0-logloss:0.01357
[148]	validation_0-logloss:0.01358
[149]	validation_0-logloss:0.01359
[150]	validation_0-logloss:0.01358
[151]	validation_0-logloss:0.01358
[152]	validation_0-logloss:0.01358
[153]	validation_0-logloss:0.01359
[154]	validation_0-logloss:0.01358
[155]	validation_0-logloss:0.01360
[156]	validation_0-logloss:0.01361
[157]	validation_0-logloss:0.01362
[158]	validation_0-logloss:0.01361
[159]	validation_0-logloss:0.01364
[160]	validation_0-logloss:0.01365
[161]	validation_0-logloss:0.01365
[162]	validation_0-logloss:0.01365
[163]	validation_0-logloss:0.01372
[164]	validation_0-logloss:0.01374
[165]	validation_0-logloss:0.01371
[166]	validation_0-logloss:0.01371
[167]	validation_0-logloss:0.01371
[168]	validation_0-logloss:0.01370
[169]	validation_0-logloss:0.01370
[170]	validation_0-logloss:0.01376
[171]	validation_0-logloss:0.01371
[172]	validation_0-logloss:0.01372
[173]	validation_0-logloss:0.01373
[174]	validation_0-logloss:0.01372
[175]	validation_0-logloss:0.01373
[176]	validation_0-logloss:0.01372
[177]	validation_0-logloss:0.01371
[178]	validation_0-logloss:0.01376
[179]	validation_0-logloss:0.01377
[180]	validation_0-logloss:0.01378
[181]	validation_0-logloss:0.01378
[182]	validation_0-logloss:0.01379
[183]	validation_0-logloss:0.01380
[184]	validation_0-logloss:0.01381
[185]	validation_0-logloss:0.01381
[186]	validation_0-logloss:0.01380
[187]	validation_0-logloss:0.01383
[188]	validation_0-logloss:0.01386
[189]	validation_0-logloss:0.01386
[190]	validation_0-logloss:0.01386
[191]	validation_0-logloss:0.01384
[192]	validation_0-logloss:0.01389
[193]	validation_0-logloss:0.01388
[194]	validation_0-logloss:0.01387
[195]	validation_0-logloss:0.01385
[196]	validation_0-logloss:0.01385
[197]	validation_0-logloss:0.01386
[198]	validation_0-logloss:0.01387
[199]	validation_0-logloss:0.01384
/home/zhengkun-li/frost-risk-forecast-challenge/.venv/lib/python3.12/site-packages/xgboost/training.py:199: UserWarning: [20:59:03] WARNING: /workspace/src/learner.cc:790: 
Parameters: { "force_col_wise", "num_leaves", "verbose" } are not used.

  bst.update(dtrain, iteration=i, fobj=obj)
Training regression model for temperature...
[0]	validation_0-rmse:8.41522
[1]	validation_0-rmse:8.01390
[2]	validation_0-rmse:7.63270
[3]	validation_0-rmse:7.27214
[4]	validation_0-rmse:6.93014
[5]	validation_0-rmse:6.60433
[6]	validation_0-rmse:6.29750
[7]	validation_0-rmse:6.00598
[8]	validation_0-rmse:5.72977
[9]	validation_0-rmse:5.46837
[10]	validation_0-rmse:5.22118
[11]	validation_0-rmse:4.98660
[12]	validation_0-rmse:4.76513
[13]	validation_0-rmse:4.55631
[14]	validation_0-rmse:4.35756
[15]	validation_0-rmse:4.17106
[16]	validation_0-rmse:3.99393
[17]	validation_0-rmse:3.82711
[18]	validation_0-rmse:3.66940
[19]	validation_0-rmse:3.51977
[20]	validation_0-rmse:3.38022
[21]	validation_0-rmse:3.24866
[22]	validation_0-rmse:3.12459
[23]	validation_0-rmse:3.00728
[24]	validation_0-rmse:2.89880
[25]	validation_0-rmse:2.79601
[26]	validation_0-rmse:2.70001
[27]	validation_0-rmse:2.61035
[28]	validation_0-rmse:2.52558
[29]	validation_0-rmse:2.44719
[30]	validation_0-rmse:2.37375
[31]	validation_0-rmse:2.30539
[32]	validation_0-rmse:2.24152
[33]	validation_0-rmse:2.18313
[34]	validation_0-rmse:2.12859
[35]	validation_0-rmse:2.07733
[36]	validation_0-rmse:2.02990
[37]	validation_0-rmse:1.98559
[38]	validation_0-rmse:1.94412
[39]	validation_0-rmse:1.90647
[40]	validation_0-rmse:1.87215
[41]	validation_0-rmse:1.83948
[42]	validation_0-rmse:1.80952
[43]	validation_0-rmse:1.78210
[44]	validation_0-rmse:1.75673
[45]	validation_0-rmse:1.73403
[46]	validation_0-rmse:1.71267
[47]	validation_0-rmse:1.69277
[48]	validation_0-rmse:1.67470
[49]	validation_0-rmse:1.65775
[50]	validation_0-rmse:1.64277
[51]	validation_0-rmse:1.62850
[52]	validation_0-rmse:1.61631
[53]	validation_0-rmse:1.60389
[54]	validation_0-rmse:1.59373
[55]	validation_0-rmse:1.58406
[56]	validation_0-rmse:1.57520
[57]	validation_0-rmse:1.56667
[58]	validation_0-rmse:1.55917
[59]	validation_0-rmse:1.55192
[60]	validation_0-rmse:1.54497
[61]	validation_0-rmse:1.53920
[62]	validation_0-rmse:1.53427
[63]	validation_0-rmse:1.52918
[64]	validation_0-rmse:1.52443
[65]	validation_0-rmse:1.51984
[66]	validation_0-rmse:1.51592
[67]	validation_0-rmse:1.51187
[68]	validation_0-rmse:1.50869
[69]	validation_0-rmse:1.50528
[70]	validation_0-rmse:1.50236
[71]	validation_0-rmse:1.49944
[72]	validation_0-rmse:1.49738
[73]	validation_0-rmse:1.49476
[74]	validation_0-rmse:1.49280
[75]	validation_0-rmse:1.49110
[76]	validation_0-rmse:1.48917
[77]	validation_0-rmse:1.48749
[78]	validation_0-rmse:1.48580
[79]	validation_0-rmse:1.48398
[80]	validation_0-rmse:1.48231
[81]	validation_0-rmse:1.48101
[82]	validation_0-rmse:1.47961
[83]	validation_0-rmse:1.47820
[84]	validation_0-rmse:1.47718
[85]	validation_0-rmse:1.47561
[86]	validation_0-rmse:1.47451
[87]	validation_0-rmse:1.47306
[88]	validation_0-rmse:1.47214
[89]	validation_0-rmse:1.47127
[90]	validation_0-rmse:1.47033
[91]	validation_0-rmse:1.46937
[92]	validation_0-rmse:1.46836
[93]	validation_0-rmse:1.46742
[94]	validation_0-rmse:1.46612
[95]	validation_0-rmse:1.46543
[96]	validation_0-rmse:1.46468
[97]	validation_0-rmse:1.46352
[98]	validation_0-rmse:1.46295
[99]	validation_0-rmse:1.46242
[100]	validation_0-rmse:1.46182
[101]	validation_0-rmse:1.46132
[102]	validation_0-rmse:1.46083
[103]	validation_0-rmse:1.46021
[104]	validation_0-rmse:1.45941
[105]	validation_0-rmse:1.45888
[106]	validation_0-rmse:1.45842
[107]	validation_0-rmse:1.45779
[108]	validation_0-rmse:1.45716
[109]	validation_0-rmse:1.45627
[110]	validation_0-rmse:1.45561
[111]	validation_0-rmse:1.45487
[112]	validation_0-rmse:1.45444
[113]	validation_0-rmse:1.45370
[114]	validation_0-rmse:1.45344
[115]	validation_0-rmse:1.45316
[116]	validation_0-rmse:1.45278
[117]	validation_0-rmse:1.45200
[118]	validation_0-rmse:1.45139
[119]	validation_0-rmse:1.45044
[120]	validation_0-rmse:1.45008
[121]	validation_0-rmse:1.44959
[122]	validation_0-rmse:1.44935
[123]	validation_0-rmse:1.44889
[124]	validation_0-rmse:1.44820
[125]	validation_0-rmse:1.44793
[126]	validation_0-rmse:1.44710
[127]	validation_0-rmse:1.44686
[128]	validation_0-rmse:1.44604
[129]	validation_0-rmse:1.44537
[130]	validation_0-rmse:1.44493
[131]	validation_0-rmse:1.44440
[132]	validation_0-rmse:1.44368
[133]	validation_0-rmse:1.44337
[134]	validation_0-rmse:1.44273
[135]	validation_0-rmse:1.44245
[136]	validation_0-rmse:1.44209
[137]	validation_0-rmse:1.44176
[138]	validation_0-rmse:1.44123
[139]	validation_0-rmse:1.44055
[140]	validation_0-rmse:1.43988
[141]	validation_0-rmse:1.43915
[142]	validation_0-rmse:1.43857
[143]	validation_0-rmse:1.43807
[144]	validation_0-rmse:1.43771
[145]	validation_0-rmse:1.43743
[146]	validation_0-rmse:1.43690
[147]	validation_0-rmse:1.43674
[148]	validation_0-rmse:1.43651
[149]	validation_0-rmse:1.43609
[150]	validation_0-rmse:1.43585
[151]	validation_0-rmse:1.43546
[152]	validation_0-rmse:1.43512
[153]	validation_0-rmse:1.43476
[154]	validation_0-rmse:1.43448
[155]	validation_0-rmse:1.43411
[156]	validation_0-rmse:1.43399
[157]	validation_0-rmse:1.43387
[158]	validation_0-rmse:1.43351
[159]	validation_0-rmse:1.43313
[160]	validation_0-rmse:1.43278
[161]	validation_0-rmse:1.43244
[162]	validation_0-rmse:1.43214
[163]	validation_0-rmse:1.43176
[164]	validation_0-rmse:1.43141
[165]	validation_0-rmse:1.43130
[166]	validation_0-rmse:1.43102
[167]	validation_0-rmse:1.43080
[168]	validation_0-rmse:1.43064
[169]	validation_0-rmse:1.43037
[170]	validation_0-rmse:1.43007
[171]	validation_0-rmse:1.42987
[172]	validation_0-rmse:1.42962
[173]	validation_0-rmse:1.42945
[174]	validation_0-rmse:1.42930
[175]	validation_0-rmse:1.42881
[176]	validation_0-rmse:1.42849
[177]	validation_0-rmse:1.42833
[178]	validation_0-rmse:1.42789
[179]	validation_0-rmse:1.42769
[180]	validation_0-rmse:1.42751
[181]	validation_0-rmse:1.42704
[182]	validation_0-rmse:1.42717
[183]	validation_0-rmse:1.42669
[184]	validation_0-rmse:1.42639
[185]	validation_0-rmse:1.42616
[186]	validation_0-rmse:1.42599
[187]	validation_0-rmse:1.42582
[188]	validation_0-rmse:1.42552
[189]	validation_0-rmse:1.42536
[190]	validation_0-rmse:1.42515
[191]	validation_0-rmse:1.42503
[192]	validation_0-rmse:1.42473
[193]	validation_0-rmse:1.42453
[194]	validation_0-rmse:1.42425
[195]	validation_0-rmse:1.42422
[196]	validation_0-rmse:1.42419
[197]	validation_0-rmse:1.42384
[198]	validation_0-rmse:1.42372
[199]	validation_0-rmse:1.42355
/home/zhengkun-li/frost-risk-forecast-challenge/.venv/lib/python3.12/site-packages/xgboost/training.py:199: UserWarning: [20:59:45] WARNING: /workspace/src/learner.cc:790: 
Parameters: { "force_col_wise", "num_leaves", "verbose" } are not used.

  bst.update(dtrain, iteration=i, fobj=obj)

Evaluating on test set...

Classification Metrics (Frost Probability):
accuracy: 0.9959
brier_score: 0.0030
ece: 0.0016
f1: 0.6209
fn: 721
fp: 730
pr_auc: 0.6935
precision: 0.6194
recall: 0.6223
roc_auc: 0.9966
tn: 352451
tp: 1188

Regression Metrics (Temperature):
mae: 1.1210
mape: 12.001029014587402
r2: 0.9713
rmse: 1.4983

Generating reliability diagram...

============================================================
Training models for 6h horizon
============================================================
  Applying feature selection...
    Original features: 298
    Loaded feature importance from /home/zhengkun-li/frost-risk-forecast-challenge/experiments/lightgbm/feature_importance/feature_importance_3h_all.csv
  After selecting by importance: 175 features
    Selected features: 175
    Removed features: 123
Features: 175
Samples: 2367252
Frost events: 20579.0 (0.87%)
Train: 1657004, Val: 355070, Test: 355076

Training classification model for frost probability...
[0]	validation_0-logloss:0.03226
[1]	validation_0-logloss:0.03083
[2]	validation_0-logloss:0.02986
[3]	validation_0-logloss:0.02877
[4]	validation_0-logloss:0.02799
[5]	validation_0-logloss:0.02742
[6]	validation_0-logloss:0.02692
[7]	validation_0-logloss:0.02645
[8]	validation_0-logloss:0.02583
[9]	validation_0-logloss:0.02544
[10]	validation_0-logloss:0.02507
[11]	validation_0-logloss:0.02471
[12]	validation_0-logloss:0.02435
[13]	validation_0-logloss:0.02405
[14]	validation_0-logloss:0.02376
[15]	validation_0-logloss:0.02344
[16]	validation_0-logloss:0.02319
[17]	validation_0-logloss:0.02298
[18]	validation_0-logloss:0.02278
[19]	validation_0-logloss:0.02259
[20]	validation_0-logloss:0.02241
[21]	validation_0-logloss:0.02227
[22]	validation_0-logloss:0.02212
[23]	validation_0-logloss:0.02199
[24]	validation_0-logloss:0.02189
[25]	validation_0-logloss:0.02178
[26]	validation_0-logloss:0.02169
[27]	validation_0-logloss:0.02160
[28]	validation_0-logloss:0.02151
[29]	validation_0-logloss:0.02136
[30]	validation_0-logloss:0.02131
[31]	validation_0-logloss:0.02125
[32]	validation_0-logloss:0.02117
[33]	validation_0-logloss:0.02107
[34]	validation_0-logloss:0.02093
[35]	validation_0-logloss:0.02084
[36]	validation_0-logloss:0.02076
[37]	validation_0-logloss:0.02074
[38]	validation_0-logloss:0.02066
[39]	validation_0-logloss:0.02058
[40]	validation_0-logloss:0.02054
[41]	validation_0-logloss:0.02052
[42]	validation_0-logloss:0.02048
[43]	validation_0-logloss:0.02048
[44]	validation_0-logloss:0.02046
[45]	validation_0-logloss:0.02040
[46]	validation_0-logloss:0.02040
[47]	validation_0-logloss:0.02035
[48]	validation_0-logloss:0.02031
[49]	validation_0-logloss:0.02026
[50]	validation_0-logloss:0.02023
[51]	validation_0-logloss:0.02012
[52]	validation_0-logloss:0.02010
[53]	validation_0-logloss:0.02005
[54]	validation_0-logloss:0.02005
[55]	validation_0-logloss:0.02003
[56]	validation_0-logloss:0.02004
[57]	validation_0-logloss:0.02001
[58]	validation_0-logloss:0.02003
[59]	validation_0-logloss:0.02004
[60]	validation_0-logloss:0.02006
[61]	validation_0-logloss:0.02002
[62]	validation_0-logloss:0.01999
[63]	validation_0-logloss:0.01995
[64]	validation_0-logloss:0.01995
[65]	validation_0-logloss:0.01994
[66]	validation_0-logloss:0.01994
[67]	validation_0-logloss:0.01997
[68]	validation_0-logloss:0.02000
[69]	validation_0-logloss:0.02002
[70]	validation_0-logloss:0.02002
[71]	validation_0-logloss:0.02004
[72]	validation_0-logloss:0.02003
[73]	validation_0-logloss:0.02002
[74]	validation_0-logloss:0.02004
[75]	validation_0-logloss:0.02000
[76]	validation_0-logloss:0.02000
[77]	validation_0-logloss:0.02003
[78]	validation_0-logloss:0.02003
[79]	validation_0-logloss:0.02004
[80]	validation_0-logloss:0.02002
[81]	validation_0-logloss:0.02000
[82]	validation_0-logloss:0.01998
[83]	validation_0-logloss:0.01997
[84]	validation_0-logloss:0.01996
[85]	validation_0-logloss:0.01995
[86]	validation_0-logloss:0.01998
[87]	validation_0-logloss:0.01997
[88]	validation_0-logloss:0.01996
[89]	validation_0-logloss:0.01997
[90]	validation_0-logloss:0.01997
[91]	validation_0-logloss:0.01998
[92]	validation_0-logloss:0.01996
[93]	validation_0-logloss:0.01996
[94]	validation_0-logloss:0.01996
[95]	validation_0-logloss:0.01993
[96]	validation_0-logloss:0.01996
[97]	validation_0-logloss:0.02000
[98]	validation_0-logloss:0.01998
[99]	validation_0-logloss:0.01998
[100]	validation_0-logloss:0.02002
[101]	validation_0-logloss:0.02006
[102]	validation_0-logloss:0.02008
[103]	validation_0-logloss:0.02009
[104]	validation_0-logloss:0.02009
[105]	validation_0-logloss:0.02006
[106]	validation_0-logloss:0.02006
[107]	validation_0-logloss:0.02009
[108]	validation_0-logloss:0.02003
[109]	validation_0-logloss:0.01999
[110]	validation_0-logloss:0.01999
[111]	validation_0-logloss:0.02002
[112]	validation_0-logloss:0.02004
[113]	validation_0-logloss:0.02004
[114]	validation_0-logloss:0.02003
[115]	validation_0-logloss:0.02006
[116]	validation_0-logloss:0.02006
[117]	validation_0-logloss:0.02006
[118]	validation_0-logloss:0.02004
[119]	validation_0-logloss:0.02003
[120]	validation_0-logloss:0.02003
[121]	validation_0-logloss:0.01998
[122]	validation_0-logloss:0.01997
[123]	validation_0-logloss:0.01999
[124]	validation_0-logloss:0.01998
[125]	validation_0-logloss:0.02001
[126]	validation_0-logloss:0.02001
[127]	validation_0-logloss:0.01995
[128]	validation_0-logloss:0.01995
[129]	validation_0-logloss:0.01994
[130]	validation_0-logloss:0.01995
[131]	validation_0-logloss:0.01996
[132]	validation_0-logloss:0.01995
[133]	validation_0-logloss:0.01992
[134]	validation_0-logloss:0.01992
[135]	validation_0-logloss:0.01993
[136]	validation_0-logloss:0.01993
[137]	validation_0-logloss:0.01993
[138]	validation_0-logloss:0.01987
[139]	validation_0-logloss:0.01986
[140]	validation_0-logloss:0.01986
[141]	validation_0-logloss:0.01990
[142]	validation_0-logloss:0.01995
[143]	validation_0-logloss:0.01992
[144]	validation_0-logloss:0.01989
[145]	validation_0-logloss:0.01994
[146]	validation_0-logloss:0.01996
[147]	validation_0-logloss:0.01995
[148]	validation_0-logloss:0.01999
[149]	validation_0-logloss:0.02001
[150]	validation_0-logloss:0.02003
[151]	validation_0-logloss:0.02008
[152]	validation_0-logloss:0.02009
[153]	validation_0-logloss:0.02011
[154]	validation_0-logloss:0.02011
[155]	validation_0-logloss:0.02015
[156]	validation_0-logloss:0.02015
[157]	validation_0-logloss:0.02017
[158]	validation_0-logloss:0.02018
[159]	validation_0-logloss:0.02016
[160]	validation_0-logloss:0.02016
[161]	validation_0-logloss:0.02016
[162]	validation_0-logloss:0.02013
[163]	validation_0-logloss:0.02014
[164]	validation_0-logloss:0.02014
[165]	validation_0-logloss:0.02022
[166]	validation_0-logloss:0.02032
[167]	validation_0-logloss:0.02035
[168]	validation_0-logloss:0.02031
[169]	validation_0-logloss:0.02030
[170]	validation_0-logloss:0.02026
[171]	validation_0-logloss:0.02026
[172]	validation_0-logloss:0.02025
[173]	validation_0-logloss:0.02027
[174]	validation_0-logloss:0.02028
[175]	validation_0-logloss:0.02028
[176]	validation_0-logloss:0.02026
[177]	validation_0-logloss:0.02024
[178]	validation_0-logloss:0.02023
[179]	validation_0-logloss:0.02023
[180]	validation_0-logloss:0.02019
[181]	validation_0-logloss:0.02019
[182]	validation_0-logloss:0.02026
[183]	validation_0-logloss:0.02030
[184]	validation_0-logloss:0.02031
[185]	validation_0-logloss:0.02034
[186]	validation_0-logloss:0.02035
[187]	validation_0-logloss:0.02035
[188]	validation_0-logloss:0.02039
[189]	validation_0-logloss:0.02039
[190]	validation_0-logloss:0.02045
[191]	validation_0-logloss:0.02052
[192]	validation_0-logloss:0.02052
[193]	validation_0-logloss:0.02044
[194]	validation_0-logloss:0.02040
[195]	validation_0-logloss:0.02038
[196]	validation_0-logloss:0.02039
[197]	validation_0-logloss:0.02039
[198]	validation_0-logloss:0.02046
[199]	validation_0-logloss:0.02046
/home/zhengkun-li/frost-risk-forecast-challenge/.venv/lib/python3.12/site-packages/xgboost/training.py:199: UserWarning: [21:00:14] WARNING: /workspace/src/learner.cc:790: 
Parameters: { "force_col_wise", "num_leaves", "verbose" } are not used.

  bst.update(dtrain, iteration=i, fobj=obj)
Training regression model for temperature...
[0]	validation_0-rmse:8.43420
[1]	validation_0-rmse:8.05064
[2]	validation_0-rmse:7.68700
[3]	validation_0-rmse:7.34326
[4]	validation_0-rmse:7.01765
[5]	validation_0-rmse:6.71083
[6]	validation_0-rmse:6.41779
[7]	validation_0-rmse:6.14165
[8]	validation_0-rmse:5.87990
[9]	validation_0-rmse:5.63350
[10]	validation_0-rmse:5.40045
[11]	validation_0-rmse:5.17889
[12]	validation_0-rmse:4.97106
[13]	validation_0-rmse:4.77582
[14]	validation_0-rmse:4.59011
[15]	validation_0-rmse:4.41564
[16]	validation_0-rmse:4.25103
[17]	validation_0-rmse:4.09749
[18]	validation_0-rmse:3.95219
[19]	validation_0-rmse:3.81562
[20]	validation_0-rmse:3.68659
[21]	validation_0-rmse:3.56550
[22]	validation_0-rmse:3.45311
[23]	validation_0-rmse:3.34730
[24]	validation_0-rmse:3.24780
[25]	validation_0-rmse:3.15506
[26]	validation_0-rmse:3.06833
[27]	validation_0-rmse:2.98797
[28]	validation_0-rmse:2.91329
[29]	validation_0-rmse:2.84280
[30]	validation_0-rmse:2.77724
[31]	validation_0-rmse:2.71691
[32]	validation_0-rmse:2.65978
[33]	validation_0-rmse:2.60763
[34]	validation_0-rmse:2.55815
[35]	validation_0-rmse:2.51544
[36]	validation_0-rmse:2.47237
[37]	validation_0-rmse:2.43265
[38]	validation_0-rmse:2.39666
[39]	validation_0-rmse:2.36279
[40]	validation_0-rmse:2.33118
[41]	validation_0-rmse:2.30222
[42]	validation_0-rmse:2.27660
[43]	validation_0-rmse:2.25124
[44]	validation_0-rmse:2.22953
[45]	validation_0-rmse:2.20839
[46]	validation_0-rmse:2.18847
[47]	validation_0-rmse:2.16987
[48]	validation_0-rmse:2.15388
[49]	validation_0-rmse:2.13856
[50]	validation_0-rmse:2.12441
[51]	validation_0-rmse:2.10993
[52]	validation_0-rmse:2.09891
[53]	validation_0-rmse:2.08731
[54]	validation_0-rmse:2.07738
[55]	validation_0-rmse:2.06842
[56]	validation_0-rmse:2.05930
[57]	validation_0-rmse:2.05098
[58]	validation_0-rmse:2.04219
[59]	validation_0-rmse:2.03533
[60]	validation_0-rmse:2.02915
[61]	validation_0-rmse:2.02343
[62]	validation_0-rmse:2.01694
[63]	validation_0-rmse:2.01123
[64]	validation_0-rmse:2.00553
[65]	validation_0-rmse:2.00010
[66]	validation_0-rmse:1.99586
[67]	validation_0-rmse:1.99136
[68]	validation_0-rmse:1.98717
[69]	validation_0-rmse:1.98289
[70]	validation_0-rmse:1.97917
[71]	validation_0-rmse:1.97463
[72]	validation_0-rmse:1.96972
[73]	validation_0-rmse:1.96570
[74]	validation_0-rmse:1.96266
[75]	validation_0-rmse:1.95819
[76]	validation_0-rmse:1.95566
[77]	validation_0-rmse:1.95216
[78]	validation_0-rmse:1.94890
[79]	validation_0-rmse:1.94601
[80]	validation_0-rmse:1.94342
[81]	validation_0-rmse:1.94121
[82]	validation_0-rmse:1.93928
[83]	validation_0-rmse:1.93625
[84]	validation_0-rmse:1.93404
[85]	validation_0-rmse:1.93179
[86]	validation_0-rmse:1.93040
[87]	validation_0-rmse:1.92791
[88]	validation_0-rmse:1.92613
[89]	validation_0-rmse:1.92397
[90]	validation_0-rmse:1.92266
[91]	validation_0-rmse:1.92125
[92]	validation_0-rmse:1.91910
[93]	validation_0-rmse:1.91709
[94]	validation_0-rmse:1.91551
[95]	validation_0-rmse:1.91417
[96]	validation_0-rmse:1.91219
[97]	validation_0-rmse:1.91065
[98]	validation_0-rmse:1.90961
[99]	validation_0-rmse:1.90791
[100]	validation_0-rmse:1.90670
[101]	validation_0-rmse:1.90534
[102]	validation_0-rmse:1.90406
[103]	validation_0-rmse:1.90330
[104]	validation_0-rmse:1.90187
[105]	validation_0-rmse:1.90076
[106]	validation_0-rmse:1.89983
[107]	validation_0-rmse:1.89901
[108]	validation_0-rmse:1.89748
[109]	validation_0-rmse:1.89586
[110]	validation_0-rmse:1.89455
[111]	validation_0-rmse:1.89370
[112]	validation_0-rmse:1.89258
[113]	validation_0-rmse:1.89122
[114]	validation_0-rmse:1.89047
[115]	validation_0-rmse:1.88909
[116]	validation_0-rmse:1.88814
[117]	validation_0-rmse:1.88693
[118]	validation_0-rmse:1.88611
[119]	validation_0-rmse:1.88484
[120]	validation_0-rmse:1.88373
[121]	validation_0-rmse:1.88270
[122]	validation_0-rmse:1.88185
[123]	validation_0-rmse:1.88050
[124]	validation_0-rmse:1.87976
[125]	validation_0-rmse:1.87893
[126]	validation_0-rmse:1.87795
[127]	validation_0-rmse:1.87733
[128]	validation_0-rmse:1.87598
[129]	validation_0-rmse:1.87534
[130]	validation_0-rmse:1.87445
[131]	validation_0-rmse:1.87375
[132]	validation_0-rmse:1.87328
[133]	validation_0-rmse:1.87275
[134]	validation_0-rmse:1.87214
[135]	validation_0-rmse:1.87087
[136]	validation_0-rmse:1.87008
[137]	validation_0-rmse:1.86983
[138]	validation_0-rmse:1.86944
[139]	validation_0-rmse:1.86821
[140]	validation_0-rmse:1.86748
[141]	validation_0-rmse:1.86673
[142]	validation_0-rmse:1.86604
[143]	validation_0-rmse:1.86505
[144]	validation_0-rmse:1.86412
[145]	validation_0-rmse:1.86364
[146]	validation_0-rmse:1.86298
[147]	validation_0-rmse:1.86267
[148]	validation_0-rmse:1.86188
[149]	validation_0-rmse:1.86123
[150]	validation_0-rmse:1.86046
[151]	validation_0-rmse:1.85963
[152]	validation_0-rmse:1.85901
[153]	validation_0-rmse:1.85802
[154]	validation_0-rmse:1.85689
[155]	validation_0-rmse:1.85629
[156]	validation_0-rmse:1.85551
[157]	validation_0-rmse:1.85492
[158]	validation_0-rmse:1.85430
[159]	validation_0-rmse:1.85355
[160]	validation_0-rmse:1.85304
[161]	validation_0-rmse:1.85235
[162]	validation_0-rmse:1.85192
[163]	validation_0-rmse:1.85111
[164]	validation_0-rmse:1.85002
[165]	validation_0-rmse:1.84943
[166]	validation_0-rmse:1.84893
[167]	validation_0-rmse:1.84867
[168]	validation_0-rmse:1.84823
[169]	validation_0-rmse:1.84764
[170]	validation_0-rmse:1.84696
[171]	validation_0-rmse:1.84657
[172]	validation_0-rmse:1.84583
[173]	validation_0-rmse:1.84524
[174]	validation_0-rmse:1.84448
[175]	validation_0-rmse:1.84374
[176]	validation_0-rmse:1.84355
[177]	validation_0-rmse:1.84299
[178]	validation_0-rmse:1.84263
[179]	validation_0-rmse:1.84222
[180]	validation_0-rmse:1.84175
[181]	validation_0-rmse:1.84068
[182]	validation_0-rmse:1.83998
[183]	validation_0-rmse:1.83951
[184]	validation_0-rmse:1.83899
[185]	validation_0-rmse:1.83827
[186]	validation_0-rmse:1.83761
[187]	validation_0-rmse:1.83708
[188]	validation_0-rmse:1.83630
[189]	validation_0-rmse:1.83604
[190]	validation_0-rmse:1.83551
[191]	validation_0-rmse:1.83526
[192]	validation_0-rmse:1.83495
[193]	validation_0-rmse:1.83366
[194]	validation_0-rmse:1.83313
[195]	validation_0-rmse:1.83281
[196]	validation_0-rmse:1.83240
[197]	validation_0-rmse:1.83220
[198]	validation_0-rmse:1.83162
[199]	validation_0-rmse:1.83133
/home/zhengkun-li/frost-risk-forecast-challenge/.venv/lib/python3.12/site-packages/xgboost/training.py:199: UserWarning: [21:00:55] WARNING: /workspace/src/learner.cc:790: 
Parameters: { "force_col_wise", "num_leaves", "verbose" } are not used.

  bst.update(dtrain, iteration=i, fobj=obj)

Evaluating on test set...

Classification Metrics (Frost Probability):
accuracy: 0.9947
brier_score: 0.0039
ece: 0.0024
f1: 0.5256
fn: 872
fp: 1000
pr_auc: 0.5424
precision: 0.5091
recall: 0.5432
roc_auc: 0.9932
tn: 352167
tp: 1037

Regression Metrics (Temperature):
mae: 1.5139
mape: 16.430988311767578
r2: 0.9500
rmse: 1.9790

Generating reliability diagram...

============================================================
Training models for 12h horizon
============================================================
  Applying feature selection...
    Original features: 298
    Loaded feature importance from /home/zhengkun-li/frost-risk-forecast-challenge/experiments/lightgbm/feature_importance/feature_importance_3h_all.csv
  After selecting by importance: 175 features
    Selected features: 175
    Removed features: 123
Features: 175
Samples: 2367144
Frost events: 20579.0 (0.87%)
Train: 1656856, Val: 355036, Test: 355048

Training classification model for frost probability...
[0]	validation_0-logloss:0.03692
[1]	validation_0-logloss:0.03516
[2]	validation_0-logloss:0.03383
[3]	validation_0-logloss:0.03270
[4]	validation_0-logloss:0.03171
[5]	validation_0-logloss:0.03093
[6]	validation_0-logloss:0.03019
[7]	validation_0-logloss:0.02942
[8]	validation_0-logloss:0.02867
[9]	validation_0-logloss:0.02810
[10]	validation_0-logloss:0.02757
[11]	validation_0-logloss:0.02697
[12]	validation_0-logloss:0.02653
[13]	validation_0-logloss:0.02611
[14]	validation_0-logloss:0.02573
[15]	validation_0-logloss:0.02533
[16]	validation_0-logloss:0.02503
[17]	validation_0-logloss:0.02472
[18]	validation_0-logloss:0.02439
[19]	validation_0-logloss:0.02411
[20]	validation_0-logloss:0.02386
[21]	validation_0-logloss:0.02366
[22]	validation_0-logloss:0.02343
[23]	validation_0-logloss:0.02320
[24]	validation_0-logloss:0.02297
[25]	validation_0-logloss:0.02280
[26]	validation_0-logloss:0.02265
[27]	validation_0-logloss:0.02252
[28]	validation_0-logloss:0.02240
[29]	validation_0-logloss:0.02223
[30]	validation_0-logloss:0.02208
[31]	validation_0-logloss:0.02198
[32]	validation_0-logloss:0.02186
[33]	validation_0-logloss:0.02177
[34]	validation_0-logloss:0.02166
[35]	validation_0-logloss:0.02158
[36]	validation_0-logloss:0.02144
[37]	validation_0-logloss:0.02137
[38]	validation_0-logloss:0.02129
[39]	validation_0-logloss:0.02122
[40]	validation_0-logloss:0.02116
[41]	validation_0-logloss:0.02107
[42]	validation_0-logloss:0.02100
[43]	validation_0-logloss:0.02093
[44]	validation_0-logloss:0.02084
[45]	validation_0-logloss:0.02078
[46]	validation_0-logloss:0.02071
[47]	validation_0-logloss:0.02067
[48]	validation_0-logloss:0.02065
[49]	validation_0-logloss:0.02062
[50]	validation_0-logloss:0.02057
[51]	validation_0-logloss:0.02054
[52]	validation_0-logloss:0.02057
[53]	validation_0-logloss:0.02054
[54]	validation_0-logloss:0.02050
[55]	validation_0-logloss:0.02046
[56]	validation_0-logloss:0.02041
[57]	validation_0-logloss:0.02038
[58]	validation_0-logloss:0.02032
[59]	validation_0-logloss:0.02030
[60]	validation_0-logloss:0.02031
[61]	validation_0-logloss:0.02030
[62]	validation_0-logloss:0.02027
[63]	validation_0-logloss:0.02025
[64]	validation_0-logloss:0.02025
[65]	validation_0-logloss:0.02022
[66]	validation_0-logloss:0.02021
[67]	validation_0-logloss:0.02019
[68]	validation_0-logloss:0.02015
[69]	validation_0-logloss:0.02015
[70]	validation_0-logloss:0.02012
[71]	validation_0-logloss:0.02009
[72]	validation_0-logloss:0.02010
[73]	validation_0-logloss:0.02009
[74]	validation_0-logloss:0.02009
[75]	validation_0-logloss:0.02011
[76]	validation_0-logloss:0.02012
[77]	validation_0-logloss:0.02011
[78]	validation_0-logloss:0.02011
[79]	validation_0-logloss:0.02008
[80]	validation_0-logloss:0.02007
[81]	validation_0-logloss:0.02006
[82]	validation_0-logloss:0.02010
[83]	validation_0-logloss:0.02011
[84]	validation_0-logloss:0.02011
[85]	validation_0-logloss:0.02011
[86]	validation_0-logloss:0.02012
[87]	validation_0-logloss:0.02012
[88]	validation_0-logloss:0.02019
[89]	validation_0-logloss:0.02019
[90]	validation_0-logloss:0.02019
[91]	validation_0-logloss:0.02020
[92]	validation_0-logloss:0.02021
[93]	validation_0-logloss:0.02018
[94]	validation_0-logloss:0.02022
[95]	validation_0-logloss:0.02023
[96]	validation_0-logloss:0.02025
[97]	validation_0-logloss:0.02025
[98]	validation_0-logloss:0.02025
[99]	validation_0-logloss:0.02026
[100]	validation_0-logloss:0.02026
[101]	validation_0-logloss:0.02027
[102]	validation_0-logloss:0.02028
[103]	validation_0-logloss:0.02025
[104]	validation_0-logloss:0.02027
[105]	validation_0-logloss:0.02028
[106]	validation_0-logloss:0.02028
[107]	validation_0-logloss:0.02031
[108]	validation_0-logloss:0.02032
[109]	validation_0-logloss:0.02036
[110]	validation_0-logloss:0.02034
[111]	validation_0-logloss:0.02034
[112]	validation_0-logloss:0.02036
[113]	validation_0-logloss:0.02035
[114]	validation_0-logloss:0.02036
[115]	validation_0-logloss:0.02034
[116]	validation_0-logloss:0.02039
[117]	validation_0-logloss:0.02038
[118]	validation_0-logloss:0.02038
[119]	validation_0-logloss:0.02038
[120]	validation_0-logloss:0.02040
[121]	validation_0-logloss:0.02040
[122]	validation_0-logloss:0.02040
[123]	validation_0-logloss:0.02042
[124]	validation_0-logloss:0.02044
[125]	validation_0-logloss:0.02044
[126]	validation_0-logloss:0.02047
[127]	validation_0-logloss:0.02047
[128]	validation_0-logloss:0.02047
[129]	validation_0-logloss:0.02045
[130]	validation_0-logloss:0.02044
[131]	validation_0-logloss:0.02045
[132]	validation_0-logloss:0.02049
[133]	validation_0-logloss:0.02049
[134]	validation_0-logloss:0.02049
[135]	validation_0-logloss:0.02047
[136]	validation_0-logloss:0.02052
[137]	validation_0-logloss:0.02051
[138]	validation_0-logloss:0.02051
[139]	validation_0-logloss:0.02051
[140]	validation_0-logloss:0.02052
[141]	validation_0-logloss:0.02054
[142]	validation_0-logloss:0.02054
[143]	validation_0-logloss:0.02054
[144]	validation_0-logloss:0.02054
[145]	validation_0-logloss:0.02058
[146]	validation_0-logloss:0.02058
[147]	validation_0-logloss:0.02062
[148]	validation_0-logloss:0.02061
[149]	validation_0-logloss:0.02062
[150]	validation_0-logloss:0.02067
[151]	validation_0-logloss:0.02070
[152]	validation_0-logloss:0.02070
[153]	validation_0-logloss:0.02074
[154]	validation_0-logloss:0.02076
[155]	validation_0-logloss:0.02076
[156]	validation_0-logloss:0.02077
[157]	validation_0-logloss:0.02076
[158]	validation_0-logloss:0.02078
[159]	validation_0-logloss:0.02080
[160]	validation_0-logloss:0.02077
[161]	validation_0-logloss:0.02077
[162]	validation_0-logloss:0.02077
[163]	validation_0-logloss:0.02077
[164]	validation_0-logloss:0.02080
[165]	validation_0-logloss:0.02082
[166]	validation_0-logloss:0.02084
[167]	validation_0-logloss:0.02085
[168]	validation_0-logloss:0.02087
[169]	validation_0-logloss:0.02091
[170]	validation_0-logloss:0.02092
[171]	validation_0-logloss:0.02095
[172]	validation_0-logloss:0.02096
[173]	validation_0-logloss:0.02101
[174]	validation_0-logloss:0.02104
[175]	validation_0-logloss:0.02106
[176]	validation_0-logloss:0.02109
[177]	validation_0-logloss:0.02112
[178]	validation_0-logloss:0.02112
[179]	validation_0-logloss:0.02113
[180]	validation_0-logloss:0.02113
[181]	validation_0-logloss:0.02116
[182]	validation_0-logloss:0.02120
[183]	validation_0-logloss:0.02119
[184]	validation_0-logloss:0.02120
[185]	validation_0-logloss:0.02120
[186]	validation_0-logloss:0.02121
[187]	validation_0-logloss:0.02122
[188]	validation_0-logloss:0.02123
[189]	validation_0-logloss:0.02128
[190]	validation_0-logloss:0.02130
[191]	validation_0-logloss:0.02134
[192]	validation_0-logloss:0.02134
[193]	validation_0-logloss:0.02130
[194]	validation_0-logloss:0.02133
[195]	validation_0-logloss:0.02131
[196]	validation_0-logloss:0.02133
[197]	validation_0-logloss:0.02134
[198]	validation_0-logloss:0.02133
[199]	validation_0-logloss:0.02132
/home/zhengkun-li/frost-risk-forecast-challenge/.venv/lib/python3.12/site-packages/xgboost/training.py:199: UserWarning: [21:01:25] WARNING: /workspace/src/learner.cc:790: 
Parameters: { "force_col_wise", "num_leaves", "verbose" } are not used.

  bst.update(dtrain, iteration=i, fobj=obj)
Training regression model for temperature...
[0]	validation_0-rmse:8.43222
[1]	validation_0-rmse:8.04853
[2]	validation_0-rmse:7.68597
[3]	validation_0-rmse:7.34281
[4]	validation_0-rmse:7.01944
[5]	validation_0-rmse:6.71465
[6]	validation_0-rmse:6.42654
[7]	validation_0-rmse:6.15482
[8]	validation_0-rmse:5.90085
[9]	validation_0-rmse:5.65918
[10]	validation_0-rmse:5.43177
[11]	validation_0-rmse:5.21532
[12]	validation_0-rmse:5.01321
[13]	validation_0-rmse:4.82272
[14]	validation_0-rmse:4.64451
[15]	validation_0-rmse:4.47527
[16]	validation_0-rmse:4.31960
[17]	validation_0-rmse:4.17355
[18]	validation_0-rmse:4.03656
[19]	validation_0-rmse:3.90720
[20]	validation_0-rmse:3.78698
[21]	validation_0-rmse:3.67128
[22]	validation_0-rmse:3.56736
[23]	validation_0-rmse:3.47072
[24]	validation_0-rmse:3.37706
[25]	validation_0-rmse:3.29294
[26]	validation_0-rmse:3.21499
[27]	validation_0-rmse:3.14275
[28]	validation_0-rmse:3.07200
[29]	validation_0-rmse:3.00632
[30]	validation_0-rmse:2.94922
[31]	validation_0-rmse:2.89255
[32]	validation_0-rmse:2.84433
[33]	validation_0-rmse:2.79928
[34]	validation_0-rmse:2.75682
[35]	validation_0-rmse:2.71804
[36]	validation_0-rmse:2.68230
[37]	validation_0-rmse:2.64889
[38]	validation_0-rmse:2.61741
[39]	validation_0-rmse:2.59051
[40]	validation_0-rmse:2.56405
[41]	validation_0-rmse:2.53648
[42]	validation_0-rmse:2.51405
[43]	validation_0-rmse:2.49447
[44]	validation_0-rmse:2.47615
[45]	validation_0-rmse:2.45895
[46]	validation_0-rmse:2.44181
[47]	validation_0-rmse:2.42593
[48]	validation_0-rmse:2.41158
[49]	validation_0-rmse:2.39865
[50]	validation_0-rmse:2.38395
[51]	validation_0-rmse:2.37259
[52]	validation_0-rmse:2.36012
[53]	validation_0-rmse:2.35072
[54]	validation_0-rmse:2.34324
[55]	validation_0-rmse:2.33442
[56]	validation_0-rmse:2.32705
[57]	validation_0-rmse:2.31932
[58]	validation_0-rmse:2.31044
[59]	validation_0-rmse:2.30251
[60]	validation_0-rmse:2.29628
[61]	validation_0-rmse:2.29049
[62]	validation_0-rmse:2.28495
[63]	validation_0-rmse:2.28049
[64]	validation_0-rmse:2.27621
[65]	validation_0-rmse:2.27162
[66]	validation_0-rmse:2.26777
[67]	validation_0-rmse:2.26290
[68]	validation_0-rmse:2.25896
[69]	validation_0-rmse:2.25508
[70]	validation_0-rmse:2.25124
[71]	validation_0-rmse:2.24740
[72]	validation_0-rmse:2.24272
[73]	validation_0-rmse:2.23887
[74]	validation_0-rmse:2.23614
[75]	validation_0-rmse:2.23201
[76]	validation_0-rmse:2.22846
[77]	validation_0-rmse:2.22612
[78]	validation_0-rmse:2.22324
[79]	validation_0-rmse:2.22070
[80]	validation_0-rmse:2.21752
[81]	validation_0-rmse:2.21409
[82]	validation_0-rmse:2.21131
[83]	validation_0-rmse:2.20807
[84]	validation_0-rmse:2.20658
[85]	validation_0-rmse:2.20504
[86]	validation_0-rmse:2.20308
[87]	validation_0-rmse:2.20119
[88]	validation_0-rmse:2.20012
[89]	validation_0-rmse:2.19778
[90]	validation_0-rmse:2.19557
[91]	validation_0-rmse:2.19422
[92]	validation_0-rmse:2.19253
[93]	validation_0-rmse:2.19076
[94]	validation_0-rmse:2.18910
[95]	validation_0-rmse:2.18784
[96]	validation_0-rmse:2.18594
[97]	validation_0-rmse:2.18435
[98]	validation_0-rmse:2.18312
[99]	validation_0-rmse:2.18129
[100]	validation_0-rmse:2.18015
[101]	validation_0-rmse:2.17890
[102]	validation_0-rmse:2.17803
[103]	validation_0-rmse:2.17651
[104]	validation_0-rmse:2.17561
[105]	validation_0-rmse:2.17450
[106]	validation_0-rmse:2.17324
[107]	validation_0-rmse:2.17178
[108]	validation_0-rmse:2.17072
[109]	validation_0-rmse:2.16960
[110]	validation_0-rmse:2.16784
[111]	validation_0-rmse:2.16700
[112]	validation_0-rmse:2.16604
[113]	validation_0-rmse:2.16469
[114]	validation_0-rmse:2.16363
[115]	validation_0-rmse:2.16299
[116]	validation_0-rmse:2.16202
[117]	validation_0-rmse:2.16092
[118]	validation_0-rmse:2.16008
[119]	validation_0-rmse:2.15887
[120]	validation_0-rmse:2.15809
[121]	validation_0-rmse:2.15759
[122]	validation_0-rmse:2.15658
[123]	validation_0-rmse:2.15563
[124]	validation_0-rmse:2.15467
[125]	validation_0-rmse:2.15410
[126]	validation_0-rmse:2.15361
[127]	validation_0-rmse:2.15261
[128]	validation_0-rmse:2.15128
[129]	validation_0-rmse:2.15107
[130]	validation_0-rmse:2.14991
[131]	validation_0-rmse:2.14901
[132]	validation_0-rmse:2.14880
[133]	validation_0-rmse:2.14799
[134]	validation_0-rmse:2.14739
[135]	validation_0-rmse:2.14658
[136]	validation_0-rmse:2.14603
[137]	validation_0-rmse:2.14550
[138]	validation_0-rmse:2.14455
[139]	validation_0-rmse:2.14421
[140]	validation_0-rmse:2.14345
[141]	validation_0-rmse:2.14276
[142]	validation_0-rmse:2.14199
[143]	validation_0-rmse:2.14138
[144]	validation_0-rmse:2.14074
[145]	validation_0-rmse:2.14030
[146]	validation_0-rmse:2.13993
[147]	validation_0-rmse:2.13978
[148]	validation_0-rmse:2.13919
[149]	validation_0-rmse:2.13851
[150]	validation_0-rmse:2.13753
[151]	validation_0-rmse:2.13677
[152]	validation_0-rmse:2.13612
[153]	validation_0-rmse:2.13593
[154]	validation_0-rmse:2.13553
[155]	validation_0-rmse:2.13491
[156]	validation_0-rmse:2.13419
[157]	validation_0-rmse:2.13302
[158]	validation_0-rmse:2.13287
[159]	validation_0-rmse:2.13249
[160]	validation_0-rmse:2.13238
[161]	validation_0-rmse:2.13201
[162]	validation_0-rmse:2.13135
[163]	validation_0-rmse:2.13084
[164]	validation_0-rmse:2.13025
[165]	validation_0-rmse:2.13000
[166]	validation_0-rmse:2.13174
[167]	validation_0-rmse:2.13095
[168]	validation_0-rmse:2.13025
[169]	validation_0-rmse:2.12992
[170]	validation_0-rmse:2.12962
[171]	validation_0-rmse:2.12930
[172]	validation_0-rmse:2.12898
[173]	validation_0-rmse:2.12813
[174]	validation_0-rmse:2.12763
[175]	validation_0-rmse:2.12715
[176]	validation_0-rmse:2.12673
[177]	validation_0-rmse:2.12617
[178]	validation_0-rmse:2.12581
[179]	validation_0-rmse:2.12564
[180]	validation_0-rmse:2.12496
[181]	validation_0-rmse:2.12469
[182]	validation_0-rmse:2.12418
[183]	validation_0-rmse:2.12372
[184]	validation_0-rmse:2.12360
[185]	validation_0-rmse:2.12344
[186]	validation_0-rmse:2.12305
[187]	validation_0-rmse:2.12278
[188]	validation_0-rmse:2.12216
[189]	validation_0-rmse:2.12167
[190]	validation_0-rmse:2.12129
[191]	validation_0-rmse:2.12085
[192]	validation_0-rmse:2.12059
[193]	validation_0-rmse:2.11986
[194]	validation_0-rmse:2.11985
[195]	validation_0-rmse:2.11941
[196]	validation_0-rmse:2.11880
[197]	validation_0-rmse:2.11846
[198]	validation_0-rmse:2.11797
[199]	validation_0-rmse:2.11727
/home/zhengkun-li/frost-risk-forecast-challenge/.venv/lib/python3.12/site-packages/xgboost/training.py:199: UserWarning: [21:02:08] WARNING: /workspace/src/learner.cc:790: 
Parameters: { "force_col_wise", "num_leaves", "verbose" } are not used.

  bst.update(dtrain, iteration=i, fobj=obj)

Evaluating on test set...

Classification Metrics (Frost Probability):
accuracy: 0.9943
brier_score: 0.0042
ece: 0.0026
f1: 0.4681
fn: 1015
fp: 1017
pr_auc: 0.4637
precision: 0.4678
recall: 0.4683
roc_auc: 0.9890
tn: 352122
tp: 894

Regression Metrics (Temperature):
mae: 1.7739
mape: 19.706087112426758
r2: 0.9319
rmse: 2.3088

Generating reliability diagram...

============================================================
Training models for 24h horizon
============================================================
  Applying feature selection...
    Original features: 298
    Loaded feature importance from /home/zhengkun-li/frost-risk-forecast-challenge/experiments/lightgbm/feature_importance/feature_importance_3h_all.csv
  After selecting by importance: 175 features
    Selected features: 175
    Removed features: 123
Features: 175
Samples: 2366928
Frost events: 20579.0 (0.87%)
Train: 1656561, Val: 354967, Test: 354992

Training classification model for frost probability...
[0]	validation_0-logloss:0.03698
[1]	validation_0-logloss:0.03541
[2]	validation_0-logloss:0.03422
[3]	validation_0-logloss:0.03320
[4]	validation_0-logloss:0.03231
[5]	validation_0-logloss:0.03152
[6]	validation_0-logloss:0.03086
[7]	validation_0-logloss:0.03020
[8]	validation_0-logloss:0.02963
[9]	validation_0-logloss:0.02912
[10]	validation_0-logloss:0.02866
[11]	validation_0-logloss:0.02820
[12]	validation_0-logloss:0.02778
[13]	validation_0-logloss:0.02740
[14]	validation_0-logloss:0.02713
[15]	validation_0-logloss:0.02684
[16]	validation_0-logloss:0.02653
[17]	validation_0-logloss:0.02627
[18]	validation_0-logloss:0.02603
[19]	validation_0-logloss:0.02580
[20]	validation_0-logloss:0.02557
[21]	validation_0-logloss:0.02535
[22]	validation_0-logloss:0.02516
[23]	validation_0-logloss:0.02494
[24]	validation_0-logloss:0.02476
[25]	validation_0-logloss:0.02462
[26]	validation_0-logloss:0.02444
[27]	validation_0-logloss:0.02429
[28]	validation_0-logloss:0.02417
[29]	validation_0-logloss:0.02404
[30]	validation_0-logloss:0.02391
[31]	validation_0-logloss:0.02380
[32]	validation_0-logloss:0.02370
[33]	validation_0-logloss:0.02363
[34]	validation_0-logloss:0.02354
[35]	validation_0-logloss:0.02346
[36]	validation_0-logloss:0.02338
[37]	validation_0-logloss:0.02330
[38]	validation_0-logloss:0.02324
[39]	validation_0-logloss:0.02318
[40]	validation_0-logloss:0.02313
[41]	validation_0-logloss:0.02308
[42]	validation_0-logloss:0.02303
[43]	validation_0-logloss:0.02298
[44]	validation_0-logloss:0.02295
[45]	validation_0-logloss:0.02291
[46]	validation_0-logloss:0.02287
[47]	validation_0-logloss:0.02284
[48]	validation_0-logloss:0.02282
[49]	validation_0-logloss:0.02277
[50]	validation_0-logloss:0.02273
[51]	validation_0-logloss:0.02269
[52]	validation_0-logloss:0.02266
[53]	validation_0-logloss:0.02263
[54]	validation_0-logloss:0.02260
[55]	validation_0-logloss:0.02257
[56]	validation_0-logloss:0.02255
[57]	validation_0-logloss:0.02253
[58]	validation_0-logloss:0.02248
[59]	validation_0-logloss:0.02245
[60]	validation_0-logloss:0.02245
[61]	validation_0-logloss:0.02242
[62]	validation_0-logloss:0.02241
[63]	validation_0-logloss:0.02240
[64]	validation_0-logloss:0.02239
[65]	validation_0-logloss:0.02238
[66]	validation_0-logloss:0.02236
[67]	validation_0-logloss:0.02235
[68]	validation_0-logloss:0.02233
[69]	validation_0-logloss:0.02232
[70]	validation_0-logloss:0.02230
[71]	validation_0-logloss:0.02230
[72]	validation_0-logloss:0.02228
[73]	validation_0-logloss:0.02228
[74]	validation_0-logloss:0.02227
[75]	validation_0-logloss:0.02227
[76]	validation_0-logloss:0.02227
[77]	validation_0-logloss:0.02226
[78]	validation_0-logloss:0.02224
[79]	validation_0-logloss:0.02222
[80]	validation_0-logloss:0.02221
[81]	validation_0-logloss:0.02222
[82]	validation_0-logloss:0.02220
[83]	validation_0-logloss:0.02218
[84]	validation_0-logloss:0.02218
[85]	validation_0-logloss:0.02220
[86]	validation_0-logloss:0.02220
[87]	validation_0-logloss:0.02219
[88]	validation_0-logloss:0.02219
[89]	validation_0-logloss:0.02218
[90]	validation_0-logloss:0.02217
[91]	validation_0-logloss:0.02215
[92]	validation_0-logloss:0.02215
[93]	validation_0-logloss:0.02216
[94]	validation_0-logloss:0.02217
[95]	validation_0-logloss:0.02217
[96]	validation_0-logloss:0.02218
[97]	validation_0-logloss:0.02218
[98]	validation_0-logloss:0.02218
[99]	validation_0-logloss:0.02219
[100]	validation_0-logloss:0.02220
[101]	validation_0-logloss:0.02220
[102]	validation_0-logloss:0.02221
[103]	validation_0-logloss:0.02220
[104]	validation_0-logloss:0.02219
[105]	validation_0-logloss:0.02220
[106]	validation_0-logloss:0.02222
[107]	validation_0-logloss:0.02223
[108]	validation_0-logloss:0.02223
[109]	validation_0-logloss:0.02224
[110]	validation_0-logloss:0.02223
[111]	validation_0-logloss:0.02222
[112]	validation_0-logloss:0.02223
[113]	validation_0-logloss:0.02223
[114]	validation_0-logloss:0.02223
[115]	validation_0-logloss:0.02225
[116]	validation_0-logloss:0.02224
[117]	validation_0-logloss:0.02226
[118]	validation_0-logloss:0.02226
[119]	validation_0-logloss:0.02228
[120]	validation_0-logloss:0.02229
[121]	validation_0-logloss:0.02230
[122]	validation_0-logloss:0.02231
[123]	validation_0-logloss:0.02231
[124]	validation_0-logloss:0.02231
[125]	validation_0-logloss:0.02230
[126]	validation_0-logloss:0.02230
[127]	validation_0-logloss:0.02231
[128]	validation_0-logloss:0.02231
[129]	validation_0-logloss:0.02230
[130]	validation_0-logloss:0.02230
[131]	validation_0-logloss:0.02231
[132]	validation_0-logloss:0.02231
[133]	validation_0-logloss:0.02232
[134]	validation_0-logloss:0.02232
[135]	validation_0-logloss:0.02232
[136]	validation_0-logloss:0.02233
[137]	validation_0-logloss:0.02233
[138]	validation_0-logloss:0.02234
[139]	validation_0-logloss:0.02234
[140]	validation_0-logloss:0.02235
[141]	validation_0-logloss:0.02232
[142]	validation_0-logloss:0.02233
[143]	validation_0-logloss:0.02233
[144]	validation_0-logloss:0.02233
[145]	validation_0-logloss:0.02234
[146]	validation_0-logloss:0.02233
[147]	validation_0-logloss:0.02232
[148]	validation_0-logloss:0.02229
[149]	validation_0-logloss:0.02230
[150]	validation_0-logloss:0.02232
[151]	validation_0-logloss:0.02231
[152]	validation_0-logloss:0.02230
[153]	validation_0-logloss:0.02228
[154]	validation_0-logloss:0.02226
[155]	validation_0-logloss:0.02226
[156]	validation_0-logloss:0.02230
[157]	validation_0-logloss:0.02229
[158]	validation_0-logloss:0.02228
[159]	validation_0-logloss:0.02229
[160]	validation_0-logloss:0.02229
[161]	validation_0-logloss:0.02229
[162]	validation_0-logloss:0.02229
[163]	validation_0-logloss:0.02230
[164]	validation_0-logloss:0.02232
[165]	validation_0-logloss:0.02229
[166]	validation_0-logloss:0.02229
[167]	validation_0-logloss:0.02228
[168]	validation_0-logloss:0.02228
[169]	validation_0-logloss:0.02228
[170]	validation_0-logloss:0.02230
[171]	validation_0-logloss:0.02230
[172]	validation_0-logloss:0.02230
[173]	validation_0-logloss:0.02231
[174]	validation_0-logloss:0.02231
[175]	validation_0-logloss:0.02232
[176]	validation_0-logloss:0.02234
[177]	validation_0-logloss:0.02235
[178]	validation_0-logloss:0.02235
[179]	validation_0-logloss:0.02236
[180]	validation_0-logloss:0.02236
[181]	validation_0-logloss:0.02238
[182]	validation_0-logloss:0.02239
[183]	validation_0-logloss:0.02239
[184]	validation_0-logloss:0.02240
[185]	validation_0-logloss:0.02243
[186]	validation_0-logloss:0.02243
[187]	validation_0-logloss:0.02245
[188]	validation_0-logloss:0.02246
[189]	validation_0-logloss:0.02247
[190]	validation_0-logloss:0.02248
[191]	validation_0-logloss:0.02251
[192]	validation_0-logloss:0.02250
[193]	validation_0-logloss:0.02250
[194]	validation_0-logloss:0.02251
[195]	validation_0-logloss:0.02251
[196]	validation_0-logloss:0.02252
[197]	validation_0-logloss:0.02252
[198]	validation_0-logloss:0.02253
[199]	validation_0-logloss:0.02254
/home/zhengkun-li/frost-risk-forecast-challenge/.venv/lib/python3.12/site-packages/xgboost/training.py:199: UserWarning: [21:02:37] WARNING: /workspace/src/learner.cc:790: 
Parameters: { "force_col_wise", "num_leaves", "verbose" } are not used.

  bst.update(dtrain, iteration=i, fobj=obj)
Training regression model for temperature...
[0]	validation_0-rmse:8.43584
[1]	validation_0-rmse:8.05591
[2]	validation_0-rmse:7.69620
[3]	validation_0-rmse:7.35607
[4]	validation_0-rmse:7.03491
[5]	validation_0-rmse:6.73209
[6]	validation_0-rmse:6.44606
[7]	validation_0-rmse:6.17675
[8]	validation_0-rmse:5.92255
[9]	validation_0-rmse:5.68349
[10]	validation_0-rmse:5.45788
[11]	validation_0-rmse:5.24675
[12]	validation_0-rmse:5.04730
[13]	validation_0-rmse:4.86139
[14]	validation_0-rmse:4.68599
[15]	validation_0-rmse:4.52225
[16]	validation_0-rmse:4.36868
[17]	validation_0-rmse:4.22487
[18]	validation_0-rmse:4.09094
[19]	validation_0-rmse:3.96606
[20]	validation_0-rmse:3.84874
[21]	validation_0-rmse:3.74022
[22]	validation_0-rmse:3.63899
[23]	validation_0-rmse:3.54542
[24]	validation_0-rmse:3.45869
[25]	validation_0-rmse:3.37762
[26]	validation_0-rmse:3.30244
[27]	validation_0-rmse:3.23322
[28]	validation_0-rmse:3.16910
[29]	validation_0-rmse:3.10940
[30]	validation_0-rmse:3.05393
[31]	validation_0-rmse:3.00366
[32]	validation_0-rmse:2.95672
[33]	validation_0-rmse:2.91290
[34]	validation_0-rmse:2.87388
[35]	validation_0-rmse:2.83742
[36]	validation_0-rmse:2.80373
[37]	validation_0-rmse:2.77302
[38]	validation_0-rmse:2.74454
[39]	validation_0-rmse:2.71835
[40]	validation_0-rmse:2.69449
[41]	validation_0-rmse:2.67238
[42]	validation_0-rmse:2.65261
[43]	validation_0-rmse:2.63401
[44]	validation_0-rmse:2.61719
[45]	validation_0-rmse:2.60226
[46]	validation_0-rmse:2.58747
[47]	validation_0-rmse:2.57396
[48]	validation_0-rmse:2.56140
[49]	validation_0-rmse:2.54968
[50]	validation_0-rmse:2.53862
[51]	validation_0-rmse:2.52932
[52]	validation_0-rmse:2.52014
[53]	validation_0-rmse:2.51235
[54]	validation_0-rmse:2.50487
[55]	validation_0-rmse:2.49772
[56]	validation_0-rmse:2.49101
[57]	validation_0-rmse:2.48532
[58]	validation_0-rmse:2.47956
[59]	validation_0-rmse:2.47398
[60]	validation_0-rmse:2.46909
[61]	validation_0-rmse:2.46445
[62]	validation_0-rmse:2.46012
[63]	validation_0-rmse:2.45563
[64]	validation_0-rmse:2.45175
[65]	validation_0-rmse:2.44833
[66]	validation_0-rmse:2.44469
[67]	validation_0-rmse:2.44128
[68]	validation_0-rmse:2.43838
[69]	validation_0-rmse:2.43568
[70]	validation_0-rmse:2.43296
[71]	validation_0-rmse:2.43050
[72]	validation_0-rmse:2.42771
[73]	validation_0-rmse:2.42537
[74]	validation_0-rmse:2.42315
[75]	validation_0-rmse:2.42095
[76]	validation_0-rmse:2.41949
[77]	validation_0-rmse:2.41751
[78]	validation_0-rmse:2.41586
[79]	validation_0-rmse:2.41384
[80]	validation_0-rmse:2.41187
[81]	validation_0-rmse:2.40981
[82]	validation_0-rmse:2.40831
[83]	validation_0-rmse:2.40664
[84]	validation_0-rmse:2.40521
[85]	validation_0-rmse:2.40400
[86]	validation_0-rmse:2.40250
[87]	validation_0-rmse:2.40117
[88]	validation_0-rmse:2.40009
[89]	validation_0-rmse:2.39886
[90]	validation_0-rmse:2.39753
[91]	validation_0-rmse:2.39649
[92]	validation_0-rmse:2.39573
[93]	validation_0-rmse:2.39488
[94]	validation_0-rmse:2.39375
[95]	validation_0-rmse:2.39283
[96]	validation_0-rmse:2.39200
[97]	validation_0-rmse:2.39145
[98]	validation_0-rmse:2.39064
[99]	validation_0-rmse:2.38993
[100]	validation_0-rmse:2.38896
[101]	validation_0-rmse:2.38808
[102]	validation_0-rmse:2.38723
[103]	validation_0-rmse:2.38661
[104]	validation_0-rmse:2.38592
[105]	validation_0-rmse:2.38431
[106]	validation_0-rmse:2.38378
[107]	validation_0-rmse:2.38320
[108]	validation_0-rmse:2.38275
[109]	validation_0-rmse:2.38216
[110]	validation_0-rmse:2.38160
[111]	validation_0-rmse:2.38076
[112]	validation_0-rmse:2.37930
[113]	validation_0-rmse:2.37811
[114]	validation_0-rmse:2.37739
[115]	validation_0-rmse:2.37721
[116]	validation_0-rmse:2.37663
[117]	validation_0-rmse:2.37599
[118]	validation_0-rmse:2.37566
[119]	validation_0-rmse:2.37534
[120]	validation_0-rmse:2.37455
[121]	validation_0-rmse:2.37469
[122]	validation_0-rmse:2.37433
[123]	validation_0-rmse:2.37407
[124]	validation_0-rmse:2.37275
[125]	validation_0-rmse:2.37255
[126]	validation_0-rmse:2.37182
[127]	validation_0-rmse:2.37147
[128]	validation_0-rmse:2.37053
[129]	validation_0-rmse:2.36961
[130]	validation_0-rmse:2.36862
[131]	validation_0-rmse:2.36830
[132]	validation_0-rmse:2.36805
[133]	validation_0-rmse:2.36758
[134]	validation_0-rmse:2.36741
[135]	validation_0-rmse:2.36695
[136]	validation_0-rmse:2.36634
[137]	validation_0-rmse:2.36614
[138]	validation_0-rmse:2.36562
[139]	validation_0-rmse:2.36543
[140]	validation_0-rmse:2.36508
[141]	validation_0-rmse:2.36409
[142]	validation_0-rmse:2.36363
[143]	validation_0-rmse:2.36356
[144]	validation_0-rmse:2.36299
[145]	validation_0-rmse:2.36233
[146]	validation_0-rmse:2.36199
[147]	validation_0-rmse:2.36212
[148]	validation_0-rmse:2.36203
[149]	validation_0-rmse:2.36182
[150]	validation_0-rmse:2.36163
[151]	validation_0-rmse:2.36114
[152]	validation_0-rmse:2.36052
[153]	validation_0-rmse:2.36034
[154]	validation_0-rmse:2.35999
[155]	validation_0-rmse:2.35952
[156]	validation_0-rmse:2.35901
[157]	validation_0-rmse:2.35884
[158]	validation_0-rmse:2.35903
[159]	validation_0-rmse:2.35862
[160]	validation_0-rmse:2.35836
[161]	validation_0-rmse:2.35814
[162]	validation_0-rmse:2.35779
[163]	validation_0-rmse:2.35774
[164]	validation_0-rmse:2.35769
[165]	validation_0-rmse:2.35712
[166]	validation_0-rmse:2.35699
[167]	validation_0-rmse:2.35698
[168]	validation_0-rmse:2.35675
[169]	validation_0-rmse:2.35664
[170]	validation_0-rmse:2.35605
[171]	validation_0-rmse:2.35584
[172]	validation_0-rmse:2.35547
[173]	validation_0-rmse:2.35491
[174]	validation_0-rmse:2.35445
[175]	validation_0-rmse:2.35382
[176]	validation_0-rmse:2.35329
[177]	validation_0-rmse:2.35314
[178]	validation_0-rmse:2.35314
[179]	validation_0-rmse:2.35309
[180]	validation_0-rmse:2.35234
[181]	validation_0-rmse:2.35211
[182]	validation_0-rmse:2.35148
[183]	validation_0-rmse:2.35119
[184]	validation_0-rmse:2.35100
[185]	validation_0-rmse:2.35022
[186]	validation_0-rmse:2.34990
[187]	validation_0-rmse:2.34997
[188]	validation_0-rmse:2.34969
[189]	validation_0-rmse:2.34888
[190]	validation_0-rmse:2.34852
[191]	validation_0-rmse:2.34843
[192]	validation_0-rmse:2.34833
[193]	validation_0-rmse:2.34794
[194]	validation_0-rmse:2.34779
[195]	validation_0-rmse:2.34753
[196]	validation_0-rmse:2.34732
[197]	validation_0-rmse:2.34720
[198]	validation_0-rmse:2.34709
[199]	validation_0-rmse:2.34705

Evaluating on test set...

Classification Metrics (Frost Probability):
accuracy: 0.9919
brier_score: 0.0060
ece: 0.0049
f1: 0.3622
fn: 1088
fp: 1804
pr_auc: 0.2996
precision: 0.3128
recall: 0.4301
roc_auc: 0.9848
tn: 351279
tp: 821

Regression Metrics (Temperature):
mae: 1.9244
mape: 22.684186935424805
r2: 0.9202
rmse: 2.4979

Generating reliability diagram...

============================================================
Summary Report
============================================================

3h Horizon:
  Frost - Brier: 0.0030, ECE: 0.0016, ROC-AUC: 0.9966
  Temp  - MAE: 1.1210, RMSE: 1.4983, R: 0.9713

6h Horizon:
  Frost - Brier: 0.0039, ECE: 0.0024, ROC-AUC: 0.9932
  Temp  - MAE: 1.5139, RMSE: 1.9790, R: 0.9500

12h Horizon:
  Frost - Brier: 0.0042, ECE: 0.0026, ROC-AUC: 0.9890
  Temp  - MAE: 1.7739, RMSE: 2.3088, R: 0.9319

24h Horizon:
  Frost - Brier: 0.0060, ECE: 0.0049, ROC-AUC: 0.9848
  Temp  - MAE: 1.9244, RMSE: 2.4979, R: 0.9202

 Training completed!
Results saved to: experiments/xgboost/top175_features
